{
  "run_id": "demo-run-002",
  "tool": "claude",
  "task": "verify agentmd results endpoint",
  "timestamp": "2026-05-26T10:15:00Z",
  "claims": [
    {
      "claim": "Endpoint returns latest receipt",
      "verification_status": "verified"
    },
    {
      "claim": "Receipt includes git dirty status",
      "verification_status": "contradicted"
    }
  ],
  "decisions": [
    {
      "decision": "Hold release until endpoint smoke test exists",
      "requires_human_approval": true
    }
  ],
  "files_touched": [
    "apps/api/src/memory/server.py"
  ],
  "open_loops": [
    "Confirm rollback procedure with ops"
  ],
  "contradictions": [
    "Receipt includes git dirty status"
  ],
  "human_approval_items": [
    "Approve endpoint release gate exception"
  ],
  "verification_status": "needs_human_approval",
  "context_bundle_hash": "e8e68ca4790ae8b910334985f1910b1ebb2a4018786e13cb2d9f20bdc7fe598d",
  "receipt_hash": "257c0ae71b2c0095509dac252b19f9eb208000238acee703375c7db802f68990",
  "source_artifacts": [
    "runs/claude/002"
  ],
  "git_state": {
    "available": false,
    "commit": null,
    "dirty": null,
    "changed_files": [
      "apps/api/src/memory/server.py"
    ],
    "untracked_files": [],
    "reason": "captured_from_external_tool"
  },
  "schema_version": "lead-artifact.v1"
}
